<xs:schema xmlns:xs="http://www.w3.org/2001/XMLSchema">
    <xs:element name="registrealumnes">
        <xs:complexType>
            <xs:sequence>
                <xs:element name="alumne" maxOccurs="unbounded">
                    <xs:complexType>
                        <xs:sequence>
                            <xs:element name="nom" type="xs:string"/>
                            <xs:element name="cognom" type="xs:string"/>
                            <xs:element name="edat" type="xs:integer"/>
                        </xs:sequence>
                        <xs:attribute name="id" type="xs:integer" use="required"/>
                    </xs:complexType>
                </xs:element>
            </xs:sequence>
        </xs:complexType>
    </xs:element>
</xs:schema>